qid,abstractqueryexpansion,abstractqueryexpansion.bm25.map,star_model_count,method.1,metric.1,query.1,method.2,metric.2,query.2,method.3,metric.3,query.3,method.4,metric.4,query.4,method.5,metric.5,query.5,method.6,metric.6,query.6,method.7,metric.7,query.7,method.8,metric.8,query.8,method.9,metric.9,query.9,method.10,metric.10,query.10,method.11,metric.11,query.11,method.12,metric.12,query.12,method.13,metric.13,query.13,method.14,metric.14,query.14,method.15,metric.15,query.15,method.16,metric.16,query.16,method.17,metric.17,query.17,method.18,metric.18,query.18,method.19,metric.19,query.19,method.20,metric.20,query.20,method.21,metric.21,query.21
QALD2_te-95,Who wrote the lyrics for the Polish national anthem,0.0278,11,word2vec.topn3,0.3359,wrote lyrics polish national anthem writes penned authored songs song regional international local song hymn,wordnet.topn3,0.3333,wrote lyrics polish national anthem compose save write language lyric poem down polish up internal home subject hymn,sensedisambiguation.replace,0.3333,Who write the lyric for the polish national hymn,word2vec.topn3.replace,0.1674,writes penned authored songs song polish regional international local song hymn,wiki.topn3.replace,0.1159,socialist state ethnic nationalism self governance Nation state water transport in egypt rivers of egypt rivers of south sudan Nile,tagmee.topn3,0.1111,wrote lyrics polish national anthem Lyrics Poland Is Not Yet Lost,conceptluster.topn5.3.bm25,0.1111,wrote lyrics polish national anthem lyrics poland yet lost,wiki.topn3,0.0833,wrote lyrics polish national anthem lyrics song songs Lyrics      compositions history of poland maciej płażyński Poland Is Not Yet Lost,sensedisambiguation,0.0833,Who wrote write the lyrics lyric for the Polish national anthem hymn,wordnet.topn3.replace,0.0833,compose save write language lyric poem down polish up internal home subject hymn,adaponfields.topn3.exgov2.4.0.25.10.1.1.bm25,0.0317,"{'nation': 2, 'polish': 2, 'for': 2, 'lyric': 2, 'the': 2, 'wrote': 2, 'who': 2, 'anthem': 2, 'song': 2.0, 'edit': 1.662, 'flag': 1.62, 'spangl': 1.394, 'banner': 1.38, 'anacreont': 1.211, 'compos': 1.197, 'thee': 1.141, 'ml3561': 1.085, 'melodi': 1.028}",,,,,,,,,,,,,,,,,,,,,,,,,,,,,,
QALD2_te-97,Who painted The Storm on the Sea of Galilee,0.3135,9,wiki.topn3.replace,1.0,plant taxa by rank taxonomic rank phylum Class  biology  detritivores centipede chelicerate anatomy Millipede,tagmee.topn3.replace,1.0,Class  biology  Millipede,tagmee.topn3,0.3438,painted storm sea galilee The Storm on the Sea of Galilee,termluster.topn5.3.bm25,0.3373,painted storm sea galilee work van museum sea storm,thesaurus.topn3,0.3258,painted storm sea galilee,anchor.topn3,0.3258,painted storm sea galilee,thesaurus.topn3.replace,0.3258,painted storm sea galilee,anchor.topn3.replace,0.3258,painted storm sea galilee,conceptluster.topn5.3.bm25,0.3258,painted storm sea galilee,,,,,,,,,,,,,,,,,,,,,,,,,,,,,,,,,,,,
QALD2_te-98,Which country does the creator of Miffy come from,0.3704,10,wiki.topn3,0.6667,country creator miffy come garbagpicking loossocks gin and tonic Miffy,tagmee.topn3,0.6667,country creator miffy come Miffy,thesaurus.topn3,0.4444,country creator miffy come,anchor.topn3,0.4444,country creator miffy come,thesaurus.topn3.replace,0.4444,country creator miffy come,anchor.topn3.replace,0.4444,country creator miffy come,termluster.topn5.3.bm25,0.4444,country creator miffy come,conceptluster.topn5.3.bm25,0.4444,country creator miffy come,stem.krovetz,0.4167,which country do the creator of miffy come from,onfields.topn3.10.1.1.bm25,0.3889,"{'from': 2, 'come': 2, 'of': 2, 'creator': 2, 'the': 2, 'doe': 2, 'countri': 2, 'which': 2, 'se': 2.0, 'miffi': 2, 'rt': 1.465, 'televis': 1.442, 'ur': 1.378, 'show': 1.314, 'raison': 1.203, 'nijntj': 1.11, 'fade': 1.087, 'tva': 1.07, 'dublinbas': 1.029}",,,,,,,,,,,,,,,,,,,,,,,,,,,,,,,,,
QALD2_te-99,For which label did Elvis record his first album,0.0189,13,termluster.topn5.3.bm25,0.3245,label elvis record first album releas record music album elvi first album elvi record elvi first record,thesaurus.topn3,0.1907,label elvis record first album,anchor.topn3,0.1907,label elvis record first album,thesaurus.topn3.replace,0.1907,label elvis record first album,anchor.topn3.replace,0.1907,label elvis record first album,tagmee.topn3,0.1573,label elvis record first album Record label Elvis Presley Gramophone record First Album  Twelve album  Album,conceptluster.topn5.3.bm25,0.1573,label elvis record first album elvis presley first album twelve album record label gramophone record album,wiki.topn3,0.1424,label elvis record first album record labels independent record label independent record labels Record label cardiovascular disease deaths in tennessee sun records artists las vegas musicians Elvis Presley      in music      introductions singl music  Gramophone record     twelvalbum  bcareful what you don t wish for c cat trance First Album  Twelve album  albums media formats billboard     Album,adaponfields.topn3.exgov2.4.0.25.10.1.1.bm25,0.1077,"{'album': 2, 'first': 2, 'hi': 2, 'elvi': 2, 'did': 2, 'label': 2, 'which': 2, 'for': 2, 'record': 2, 'ation': 1.806, 'orm': 1.567, 'phillip': 1.376, 'sun': 1.337, 'np': 1.179, 'ibid': 1.177, 'presley': 1.153, 'usdi': 1.081, '10240018': 1.081, 'companymemphi': 1.081}",rm3.topn10.10.0.5.bm25,0.1028,label extra hi archer length elvi perkin did album which first record good writer song,relevancefeedback.topn10.bm25,0.0876,for which label did elvis record his first album  album song perkin writer elvi take,glove.topn3,0.0303,label elvis record first album records presley impersonators previous second third song,onfields.topn3.10.1.1.bm25,0.0226,"{'album': 2, 'first': 2, 'hi': 2, 'record': 2, 'did': 2, 'label': 2, 'which': 2, 'for': 2, 'song': 2.0, 'elvi': 2, 'stiff': 1.374, 'good': 1.333, 'archer': 1.283, 'releas': 1.242, 'kristofferson': 1.202, 'bunch': 1.182, 'wreckless': 1.091, 'muhoberac': 1.091, 'rhead': 1.091}",,,,,,,,,,,,,,,,,,,,,,,,
QALD2_te-100,Who produces Orangina,0.4737,5,bertqe.topn10.bm25,0.6766,"{'Who produces Orangina': 1.5, 'orangina first produced': 0.2857142857142857, 'global brand beton launched oranginas': 1.0, 'maker orangina credited': 0.8571428571428571, 'brand beton launched oranginas iconic': 0.7142857142857143, 'orangina owned': 0.42857142857142855}",relevancefeedback.topn10.bm25,0.6175,who produces orangina  mott citi oasi villemot ting american orangina beton water drink,onfields.topn3.10.1.1.bm25,0.5916,"{'produc': 2, 'who': 2, 'orangina': 2, 'mott': 2.0, 'oasi': 1.731, 'drink': 1.577, 'juic': 1.442, 'boufarik': 1.442, 'cocacola': 1.365, 'schwepp': 1.288, 'snappl': 1.231, 'subdivis': 1.192, 'duffymott': 1.173}",conceptnet.topn3,0.5399,produces orangina foremath beforemath an orange soda,wiki.topn3,0.5204,produces orangina sangria dr pepper seven up tic tac Orangina,,,,,,,,,,,,,,,,,,,,,,,,,,,,,,,,,,,,,,,,,,,,,,,,
QALD2_tr-1,Give me all female Russian astronauts,0.2349,14,wordnet.topn3,0.6829999999999999,give female russian astronauts throw make establish distaff female person cosmonaut spaceman,thesaurus.topn3,0.6035,give female russian astronauts,anchor.topn3,0.6035,give female russian astronauts,thesaurus.topn3.replace,0.6035,give female russian astronauts,anchor.topn3.replace,0.6035,give female russian astronauts,termluster.topn5.3.bm25,0.6035,give female russian astronauts,sensedisambiguation.replace,0.5873,impart me all female russian astronaut,rm3.topn10.10.0.5.bm25,0.4902,nicol all space european cosmonaut soyuz she jeanni give astronaut soviet russian singer femal me,sensedisambiguation,0.4114,Give impart me all female Russian astronauts astronaut,wordnet.topn3.replace,0.3932,throw make establish distaff female person russian cosmonaut spaceman,conceptluster.topn5.3.bm25,0.3812,give female russian astronauts russians astronaut give,relevancefeedback.topn10.bm25,0.3337,give me all female russian astronauts  jeanni space regina kondakova nicol soviet cosmonaut soyuz larisa,tagmee.topn3,0.3312,give female russian astronauts Give In to Me Russians Astronaut,glove.topn3,0.2805,give female russian astronauts take male woman russia moscow cosmonauts iss,,,,,,,,,,,,,,,,,,,,,
QALD2_tr-3,Who is the daughter of Bill Clinton married to,0.0041,13,adaponfields.topn3.exgov2.4.0.25.10.1.1.bm25,0.1623,"{'to': 2, 'marri': 2, 'of': 2, 'daughter': 2, 'the': 2, 'is': 2, 'who': 2, 'bill': 2, 'clinton': 2, 'presid': 1.379, 'arkansa': 1.379, 'work': 1.345, 'governor': 1.31, 'hope': 1.31, 'began': 1.172, 'univers': 1.172, 'blyth': 1.138, 'degre': 1.069}",wordnet.topn3,0.0823,daughter bill clinton married girl flier poster nib Bill Clinton William Jefferson Clinton President Clinton matrimonial conjoin get hitched with,wordnet.topn3.replace,0.0632,girl flier poster nib Bill Clinton William Jefferson Clinton President Clinton matrimonial conjoin get hitched with,conceptnet.topn3,0.040999999999999995,daughter bill clinton married female girl child dollar William Jefferson Clinton DeWitt Clinton a liar Only humans divorced,tagmee.topn3,0.0397,daughter bill clinton married Bill Clinton Same sex marriage,wiki.topn3,0.0221,daughter bill clinton married candidates in united states elections       rodham family clinton family Bill Clinton sexual orientation state recognition of same sex relationships civil union Same sex marriage,bertqe.topn10.bm25,0.0083,"{'Who is the daughter of Bill Clinton married to': 1.5, 'bill clintonhe married': 1.0, 'katherine clinton daughter edward': 0.7481646983721673, 'chelsea clintongodwin chepkurgor': 0.6595914458984998, 'broxton issue': 0.6112352377912544, 'burgh lady katherine clinton': 0.1913501436323013}",termluster.topn5.3.bm25,0.0079,daughter bill clinton married peopl presid state birth year,thesaurus.topn3,0.0063,daughter bill clinton married,anchor.topn3,0.0063,daughter bill clinton married,thesaurus.topn3.replace,0.0063,daughter bill clinton married,anchor.topn3.replace,0.0063,daughter bill clinton married,conceptnet.topn3.replace,0.0042,female girl child dollar William Jefferson Clinton DeWitt Clinton a liar Only humans divorced,,,,,,,,,,,,,,,,,,,,,,,,
QALD2_tr-4,Which river does the Brooklyn Bridge cross,0.08,17,tagmee.topn3.replace,0.33899999999999997,Limerick Lake,wiki.topn3,0.3147,river brooklyn bridge cross visitor attractions in new york city bridges in brooklyn bridges on the national register of historiplaces in new york city Brooklyn Bridge,glove.topn3,0.2599,river brooklyn bridge cross tributary bronx manhattan crossing,termluster.topn5.3.bm25,0.2514,river brooklyn bridge cross bridg citi cross unit transport street bridg citi new,glove.topn3.replace,0.2095,tributary bronx manhattan crossing cross,bertqe.topn10.bm25,0.2014,"{'Which river does the Brooklyn Bridge cross': 1.5, 'bronx river brooklyn bridge list': 1.0, 'flushing river rikers island bridge': 0.890909090909091, 'east river red hook brooklyn': 0.8363636363636363, 'brooklyn bronx river harlem river': 0.8181818181818181, 'east river sunset park brooklyn': 0.7818181818181819}",wordnet.topn3,0.2,river brooklyn bridge cross span bridge circuit hybridize get over frustrate,wordnet.topn3.replace,0.2,river brooklyn span bridge circuit hybridize get over frustrate,tagmee.topn3,0.1825,river brooklyn bridge cross Brooklyn Bridge,thesaurus.topn3,0.1406,river brooklyn bridge cross,anchor.topn3,0.1406,river brooklyn bridge cross,thesaurus.topn3.replace,0.1406,river brooklyn bridge cross,anchor.topn3.replace,0.1406,river brooklyn bridge cross,conceptluster.topn5.3.bm25,0.1406,river brooklyn bridge cross,stem.krovetz,0.1383,which river do the brooklyn bridge cross,sensedisambiguation,0.1332,Which river does the Brooklyn Bridge cross hybridization,sensedisambiguation.replace,0.0907,Which river does the brooklyn bridge hybridization,,,,,,,,,,,,
QALD2_tr-6,Where did Abraham Lincoln die,0.0176,13,tagmee.topn3.replace,0.2101,Television program Television The Walt Disney Company,wordnet.topn3.replace,0.1816,Ibrahim President Abraham Lincoln President Lincoln Abraham Lincoln snuff it die out fail,wordnet.topn3,0.1686,abraham lincoln die Ibrahim President Abraham Lincoln President Lincoln Abraham Lincoln snuff it die out fail,adaponfields.topn3.exgov2.4.0.25.10.1.1.bm25,0.1214,"{'die': 2, 'did': 2, 'where': 2, 'abraham': 2, 'lincoln': 2, 'room': 1.272, 'thoma': 1.221, 'home': 1.199, 'hous': 1.154, 'would': 1.147, 'bedroom': 1.081, 'tad': 1.074, 'mari': 1.0, 'slaveri': 1.0}",wiki.topn3,0.0615,abraham lincoln die united states presidential candidates       people from larue county  kentucky people from macon county  illinois Abraham Lincoln latten depletion gilding cast coinage Coining  mint,wiki.topn3.replace,0.0559,multiple camera setup dramatic programming sketch comedy Television program      introductions television video hardware Television timwarner walt disney pictures viacom The Walt Disney Company,stem.lovins,0.0427,whes did abraham lincoln di,thesaurus.topn3,0.0403,abraham lincoln die,anchor.topn3,0.0403,abraham lincoln die,thesaurus.topn3.replace,0.0403,abraham lincoln die,anchor.topn3.replace,0.0403,abraham lincoln die,tagmee.topn3,0.0352,abraham lincoln die Abraham Lincoln Coining  mint,termluster.topn5.3.bm25,0.0286,abraham lincoln die american lincoln birth abraham american birth,,,,,,,,,,,,,,,,,,,,,,,,
QALD2_tr-8,Which states of Germany are governed by the Social Democratic Party,0.0651,14,rm3.topn10.10.0.5.bm25,0.2521,german state european social germani polit democrat which parti elect govern feder,tagmee.topn3,0.2151,states germany governed social democratic party Member state of the European Union Germany Social Democratic Party of Germany,conceptluster.topn5.3.bm25,0.2002,states germany governed social democratic party member state european union social democratic party germany,tagmee.topn3.replace,0.1999,Mountain Annapurna,docluster.topn10.3.bm25,0.1877,which states of germany are governed by the social democratic party  parti germani elect,relevancefeedback.topn10.bm25,0.1734,which states of germany are governed by the social democratic party  democraci germani parti elect cabinet,thesaurus.topn3,0.1715,states germany governed social democratic party,anchor.topn3,0.1715,states germany governed social democratic party,thesaurus.topn3.replace,0.1715,states germany governed social democratic party,anchor.topn3.replace,0.1715,states germany governed social democratic party,termluster.topn5.3.bm25,0.1296,states germany governed social democratic party socialist social republ state socialist social state socialist social democrat germani govern state socialist social state socialist social,sensedisambiguation,0.1286,Which states state of matter of Germany are governed regulate by the Social sociable Democratic Party,bertqe.topn10.bm25,0.1045,"{'Which states of Germany are governed by the Social Democratic Party': 1.5, 'csu bavaria christian social': 1.0, 'democratic socialism cdu badenw rttemberg': 0.888888888888889, 'party germany bavarian state': 0.7777777777777778, 'peoples party kingdom prussia': 0.6666666666666667, 'einheitspartei deutschlands socialist unity party': 0.6111111111111112}",glove.topn3,0.0912,states germany governed social democratic party united u s  german berlin welfare context republican democratic,,,,,,,,,,,,,,,,,,,,,
QALD2_tr-9,Which U S  states possess gold minerals,0.0036,15,tagmee.topn3.replace,0.607,Film Film director Garry Marshall Julia Roberts,wiki.topn3.replace,0.0341,film art media media formats Film film directors film crew screenwriter Film director michael j  leeson tasha scott molly cheek Garry Marshall sandra bullock kevin bacon michellpfeiffer Julia Roberts,relevancefeedback.topn10.bm25,0.0191,which u s  states possess gold minerals  unit salt silver colombia claim new he utah rubel state,rm3.topn10.10.0.5.bm25,0.0176,mine state coal jade kosovo silver possess u  colombia which miner salt gold claim,conceptluster.topn5.3.bm25,0.0169,u s  states possess gold minerals gold mineral,termluster.topn5.3.bm25,0.0147,u s  states possess gold minerals silver possess miner gold silver miner silver state miner state silver possess,adaponfields.topn3.exgov2.4.0.25.10.1.1.bm25,0.0105,"{'possess': 2, 'state': 2, 'us': 2, 'which': 2, 'gold': 2, 'miner': 2, 'mine': 2.0, 'ore': 1.806, 'ukrain': 1.787, 'deposit': 1.722, 'uzbekistan': 1.407, 'interfax': 1.407, 'increas': 1.185, 'mtyr': 1.12, 'reportedli': 1.0}",sensedisambiguation,0.0089,Which U S  united states government states submit possess gold minerals mineral,tagmee.topn3,0.0074,u s  states possess gold minerals U S  state Gold Mineral,onfields.topn3.10.1.1.bm25,0.0066,"{'miner': 2, 'possess': 2, 'state': 2, 'us': 2, 'which': 2, 'gold': 2, 'silver': 2.0, 'metal': 1.302, 'coin': 1.193, 'element': 1.141, 'salt': 1.141, 'odyssey': 1.078, 'argentum': 1.057, 'chlorargyrit': 1.036, 'argentit': 1.036, 'rguro': 1.026}",sensedisambiguation.replace,0.0057,Which united states government submit possess gold mineral,thesaurus.topn3,0.0051,u s  states possess gold minerals,anchor.topn3,0.0051,u s  states possess gold minerals,thesaurus.topn3.replace,0.0051,u s  states possess gold minerals,anchor.topn3.replace,0.0051,u s  states possess gold minerals,,,,,,,,,,,,,,,,,,
QALD2_tr-10,In which country does the Nile start,0.0022,13,wiki.topn3,0.1169,country nile start socialist state ethnic nationalism self governance Nation state water transport in egypt rivers of egypt rivers of south sudan Nile,tagmee.topn3.replace,0.0322,Bridge Manhattan Bridge,conceptnet.topn3,0.0115,country nile start nation river beginning begin,wordnet.topn3,0.0093,country nile start body politic nation Nile River starting signal lead off embark on,wiki.topn3.replace,0.0092,bridges arch bridge suspension bridge Bridge williamsburg bridge pelham bay park  irt pelham line  new york city department of transportation Manhattan Bridge,tagmee.topn3,0.0084,country nile start Nation state Nile,adaponfields.topn3.exgov2.4.0.25.10.1.1.bm25,0.008,"{'start': 2, 'the': 2, 'doe': 2, 'countri': 2, 'which': 2, 'in': 2, 'na': 2.0, 'nile': 2, 'egypt': 1.652, 'ga': 1.492, 'question': 1.278, 'viru': 1.252, 'infect': 1.204, 'cdc': 1.163, 'increas': 1.131, 'diseas': 1.093, 'eehc': 1.083}",conceptluster.topn5.3.bm25,0.0078,country nile start nation state,wordnet.topn3.replace,0.0029,body politic nation Nile River starting signal lead off embark on,thesaurus.topn3,0.0028,country nile start,anchor.topn3,0.0028,country nile start,thesaurus.topn3.replace,0.0028,country nile start,anchor.topn3.replace,0.0028,country nile start,,,,,,,,,,,,,,,,,,,,,,,,
QALD2_tr-11,Which countries have places with more than two caves,0.0224,2,tagmee.topn3.replace,0.0737,Ethnic groups in Europe Europe Nation Constitutional monarchy,wiki.topn3.replace,0.027000000000000003,european people emigration from europe template ethnic groups in europe Ethnic groups in Europe cultural concepts peninsulas of asia europe Europe independence nationality society Nation absolutmonarchy monarchism autocracy Constitutional monarchy,,,,,,,,,,,,,,,,,,,,,,,,,,,,,,,,,,,,,,,,,,,,,,,,,,,,,,,,,
QALD2_tr-13,Which classis does the Millepede belong to,1.0,0,,,,,,,,,,,,,,,,,,,,,,,,,,,,,,,,,,,,,,,,,,,,,,,,,,,,,,,,,,,,,,,
QALD2_tr-15,Who created Goofy,0.1229,11,tagmee.topn3,0.3269,created goofy Goofy,sensedisambiguation.replace,0.2193,Who produce goofy,sensedisambiguation,0.2178,Who created produce Goofy,thesaurus.topn3,0.1944,created goofy,anchor.topn3,0.1944,created goofy,thesaurus.topn3.replace,0.1944,created goofy,anchor.topn3.replace,0.1944,created goofy,conceptluster.topn5.3.bm25,0.1944,created goofy,onfields.topn3.10.1.1.bm25,0.1778,"{'creat': 2, 'who': 2, 'goof': 2.0, 'goofi': 2, 'disney': 1.467, 'charact': 1.38, 'bear': 1.289, 'mickey': 1.277, 'rel': 1.236, 'mous': 1.186, 'donald': 1.182, 'cartoon': 1.165, 'walt': 1.149}",stem.lovins,0.1554,wh creat goof,docluster.topn10.3.bm25,0.1484,who created goofy  pete charact disnei,,,,,,,,,,,,,,,,,,,,,,,,,,,,,,
QALD2_tr-16,Give me the capitals of all countries in Africa,0.0,17,tagmee.topn3.replace,0.4245,Currency Czech Republic,wiki.topn3.replace,0.163,currency legal tender exchangrate Currency czech republic slovakia slovakia Czech Republic,word2vec.topn3,0.0244,give capitals countries africa provide capitols cities nations countires coutries african africans africa,wordnet.topn3,0.0095,give capitals countries africa throw make establish capital letter cap uppercase body politic nation,thesaurus.topn3,0.0085,give capitals countries africa,anchor.topn3,0.0085,give capitals countries africa,thesaurus.topn3.replace,0.0085,give capitals countries africa,anchor.topn3.replace,0.0085,give capitals countries africa,conceptnet.topn3,0.0044,give capitals countries africa offer provide pay caps continent flag war a continent a village an elephant,glove.topn3,0.0038,give capitals countries africa take piyanart srivalo nations governments african continent,wordnet.topn3.replace,0.0031,throw make establish capital letter cap uppercase body politic nation africa,conceptluster.topn5.3.bm25,0.002,give capitals countries africa africa roman province give,word2vec.topn3.replace,0.0016,provide capitols cities nations countires coutries african africans africa,tagmee.topn3,0.0015,give capitals countries africa Give In to Me Africa  Roman province,conceptnet.topn3.replace,0.0013,offer provide pay caps continent flag war a continent a village an elephant,glove.topn3.replace,0.0001,take piyanart srivalo nations governments african continent,relevancefeedback.topn10.bm25,0.0001,give me the capitals of all countries in africa  mandela record song european katend simon name,,,,,,,,,,,,
QALD2_tr-17,Give me all cities in New Jersey with more than        inhabitants,0.0002,13,wordnet.topn3,0.0925,give cities new jersey        inhabitants throw make establish urban center metropolis fresh raw novel Garden State NJ lakh hundred thousand denizen indweller,wordnet.topn3.replace,0.0168,throw make establish urban center metropolis fresh raw novel Garden State NJ lakh hundred thousand denizen indweller,adaponfields.topn3.exgov2.4.0.25.10.1.1.bm25,0.0161,"{'inhabit': 2, '100000': 2, 'than': 2, 'more': 2, 'with': 2, 'jersey': 2, 'new': 2, 'in': 2, 'citi': 2, 'all': 2, 'me': 2, 'give': 2, 'econom': 2.0, 'commun': 1.768, 'histor': 1.653, 'preserv': 1.579, 'neighborhood': 1.432, 'freemen': 1.379, 'newyork': 1.368, 'repres': 1.368, 'freehold': 1.347, 'hous': 1.326, 'sens': 1.284}",thesaurus.topn3,0.0123,give cities new jersey        inhabitants,anchor.topn3,0.0123,give cities new jersey        inhabitants,thesaurus.topn3.replace,0.0123,give cities new jersey inhabitants,anchor.topn3.replace,0.0123,give cities new jersey        inhabitants,glove.topn3,0.0072,give cities new jersey        inhabitants take towns york same n j  new mangxamba http   www kasparovchess com population natives,sensedisambiguation,0.0036,Give impart me all cities city in New raw Jersey new jersey with more than        hundred thousand inhabitants inhabitant,onfields.topn3.10.1.1.bm25,0.0017,"{'inhabit': 2, '100000': 2, 'than': 2, 'more': 2, 'with': 2, 'jersey': 2, 'new': 2, 'in': 2, 'citi': 2, 'all': 2, 'me': 2, 'give': 2, 'projekt': 2.0, 'backstreet': 1.78, 'endn': 1.44, 'authorityn': 1.44, 'crawlingn': 1.44, 'somewher': 1.44, 'belongn': 1.4, 'papercutn': 1.4, 'habitn': 1.36, 'sorrown': 1.36, 'numbn': 1.36}",wiki.topn3,0.0005,give cities new jersey        inhabitants video greatest hits   history foolish beat lovnever felt so good Give In to Me new jersey pennsylvania massachusetts New Jersey,termluster.topn5.3.bm25,0.0005,give cities new jersey        inhabitants york song number citi jersei york,stem.paicehusk,0.0004,giv me al city in new jersey with mor than inhabit,,,,,,,,,,,,,,,,,,,,,,,,
